X-Ecutioners,"It's Goin' Down",CB30024,15,CB30024,,CB,1," 2/27/13"
"X-Ray Specs","Germ Free Adolescent",SF109,3,SF109,,SF,1," 2/27/13"
Xscape,"Arms Of The One Who Loves You, The",SC8465,8,SC8465,,SC,1," 2/27/13"
Xscape,"Do You Want To",SC8268,2,SC8268,,SC,1," 2/27/13"
Xscape,"Just Kickin' It",SC8272,6,SC8272,,SC,1," 2/27/13"
Xscape,Understanding,DK085,5,DK085,,DK,1," 2/27/13"
Xscape,"Who Can I Run To",SC8212,14,SC8212,,SC,1," 2/27/13"
Xtc,"Mayor Of Simpleton, The",SC8678,7,SC8678,,SC,1," 2/27/13"
"Xtm & Dj Chucky Presents","Fly On The Wings Of Love",SF207,10,SF207,,SF,1," 2/27/13"
