10Cc,"I'm Not In Love",DK082,14,DK082,,DK,1," 2/27/13"
112,"It's Over Now",SC8672,15,SC8672,,SC,1," 2/27/13"
"3 Doors Down","It's Not My Time",PHMP0806,7,PHMP0806,,PH,1," 2/27/13"
"38 Special","If I'd Been The One",SC8621,14,SC8621,,SC,1," 2/27/13"
"50 Cent","If I Can't",SC3388,5,SC3388,,SC,1," 2/27/13"
"50 Cent","In Da Club",SF206,9,SF206,,SF,1," 2/27/13"
"50 Cent","In Da Clubÿ",THH0305,11,THH0305,,TH,1," 2/27/13"
"50 Cent wvocal","If I Can't",SC3388,13,SC3388,,SC,1," 2/27/13"
702,"I Still Love You",THMH0307,11,THMH0307,,TH,1," 2/27/13"
"98 Degrees","I Do (Cherish You)",CBEP457-6,7,CBEP457-6,,CB,1," 2/27/13"
"98 Degrees wvocal","I Do (Cherish You)",PHM9910,12,PHM9910,,PH,1," 2/27/13"
"A Day To Remember","It's Complicated",PHMP1202,4,PHMP1202,,PH,1," 2/27/13"
Aaliyah,"I Care 4 U",CB30026,11,CB30026,,CB,1," 2/27/13"
Aaliyah,"If Your Girl Only Knew",SC8320,15,SC8320,,SC,1," 2/27/13"
"Aaliyah wvocal","I Care 4 U",PHU0212,11,PHU0212,,PH,1," 2/27/13"
Abba,"I Do I Do I Do I Do I Do",MM6302,5,MM6302,,MM,1," 2/27/13"
Abba,"I Have A Dream",MM6302,6,MM6302,,MM,1," 2/27/13"
ACDC,"It's A Long Way To The Top",SC8869,8,SC8869,,SC,1," 2/27/13"
"Adam Lambert","If I Had You",PHMP1008,4,PHMP1008,,PH,1," 2/27/13"
"Adams & Streisand","I Finally Found Someone",SC2154,8,SC2154,,SC,1," 2/27/13"
"Adams & Turner","It's Only Love",SC8482,3,SC8482,,SC,1," 2/27/13"
"Adams, Bryan","I Do It For You",SC7514,8,SC7514,,SC,1," 2/27/13"
"Adams, Bryan","I Do It For You (Everything I Do)",SC2407,8,SC2407,,SC,1," 2/27/13"
"Adams, Bryan","I'll Always Be Right There",MMGCP9809,17,MMGCP9809,,MM,1," 2/27/13"
"Adams, Bryan","Inside Out",SF144,16,SF144,,SF,1," 2/27/13"
"Adams, Bryan & Streisand, Barbra","I Finally Found Someone",SC7600,8,SC7600,,SC,1," 2/27/13"
Addicted,"Iglesias, Enrique",PHM0401,3,PHM0401,,PH,1," 2/27/13"
Adele,"I Can't Make You Love Me",PHMP1203,5,PHMP1203,,PH,1," 2/27/13"
"Adkins, Trace","I Left Something Turned On At Home",MMGCP9808,16,MMGCP9808,,MM,1," 2/27/13"
"Adkins, Trace","I'm Gonna Love You Anyway",SC8630,9,SC8630,,SC,1," 2/27/13"
"Adkins, Trace","I'm Tryin'",MM6347,15,MM6347,,MM,1," 2/27/13"
"Adkins, Trace","I'm Gonna Love You Anyway",CB60206,6,CB60206,,CB,1," 2/27/13"
Aerosmith,"I Didn't Want To Miss A Thing",MM6250,7,MM6250,,MM,1," 2/27/13"
Aerosmith,"I Don't Want To Miss A Thing",MMCP2K09,10,MMCP2K09,,MM,1," 2/27/13"
"Aguilera, Christina","I Turn To You",MM6300,14,MM6300,,MM,1," 2/27/13"
"Aguilera, Christina",Impossible,SC8827,11,SC8827,,SC,1," 2/27/13"
"Aguilera, Christina wvocal",Impossible,SC3368,12,SC3368,,SC,1," 2/27/13"
"Aiken, Clay","I Will Carry You",SC8888,7,SC8888,,SC,1," 2/27/13"
"Aiken, Clay",Invisible,THP0401,13,THP0401,,TH,1," 2/27/13"
"Aiken, Clay wvocal",Invisible,SC3391,14,SC3391,,SC,1," 2/27/13"
"Ain't Misbehavin'","I've Got A Feeling I'm Falling",MM6023,14,MM6023,,MM,1," 2/27/13"
"Akins, Rhett","I Brake For Brunettes",SC8260,8,SC8260,,SC,1," 2/27/13"
"Akins, Rhett","In Your Love",CB60309,7,CB60309,,CB,1," 2/27/13"
"Al B Sure","I Love It (Papi Aye Aye Aye)",PHMU0910,8,PHMU0910,,PH,1," 2/27/13"
Alabama,"I'm In A Hurry (& Don't Know Why)",SC8177,8,SC8177,,SC,1," 2/27/13"
Alabama,"I'm In A Hurry And I Don't Know Why",CB60055,5,CB60055,,CB,1," 2/27/13"
Alabama,"I'm In The Mood",SC8769,13,SC8769,,SC,1," 2/27/13"
Alabama,"If I Had You",CB90001,14,CB90001,,CB,1," 2/27/13"
Alabama,"If You're Gonna Play In Texas",CBE2-06,7,CBE2-06,,CB,1," 2/27/13"
Alabama,"In Pictures",SC8198,12,SC8198,,SC,1," 2/27/13"
Alabama,"It Works",SC8239,11,SC8239,,SC,1," 2/27/13"
Alabamaÿ,"I'm In A Hurry (And Don't Know Why)",CB90153,5,CB90153,,CB,1," 2/27/13"
Alabamaÿ,"In Pictures",CB90153,12,CB90153,,CB,1," 2/27/13"
"Alan Jackson","I Still Like Bologna",PHMC0910,3,PHMC0910,,PH,1," 2/27/13"
"Alan Jackson","It's Just That Way",PHMC1003,1,PHMC1003,,PH,1," 2/27/13"
"Alex Boyd","I Wish I Knew",PHMU1211,1,PHMU1211,,PH,1," 2/27/13"
"Alisha's Attic","I Am, I Feel",SC8448,13,SC8448,,SC,1," 2/27/13"
"All 4 One","I Can Love You Like That",MM6119,13,MM6119,,MM,1," 2/27/13"
"All 4 One","I Swear",MM6049,1,MM6049,,MM,1," 2/27/13"
"All For One","I Swear",MMRB2-1,10,MMRB2-1,,MM,1," 2/27/13"
"All Saints","I Know Where It's At",PHM9802,6,PHM9802,,PH,1," 2/27/13"
"All Time Low","If These Sheets Were States",PHMP1302,2,PHMP1302,,PH,1," 2/27/13"
All-4-One,"I Can Love You Like That",SC8187,2,SC8187,,SC,1," 2/27/13"
All-4-One,"I Swear",DKM2021,14,DKM2021,,DK,1," 2/27/13"
All-4-One,"I Will Be Right There",SC8569,10,SC8569,,SC,1," 2/27/13"
All-4-One,"I'm Your Man",SD022,9,SD022,,SD,1," 2/27/13"
"Allan, Gary","I'll Take Today",SD058,12,SD058,,SD,1," 2/27/13"
"Allan, Gary","I'm Doing My Best",CB60248,14,CB60248,,CB,1," 2/27/13"
"Allan, Gary","It Would Be You",CHM9808,20,CHM9808,,CH,1," 2/27/13"
"Allen, David","I Only Have Eyes For You",SAVP35,17,SAVP35,,SA,1," 2/27/13"
"Allen, Deborah","I've Been Wrong Before",SC8697,2,SC8697,,SC,1," 2/27/13"
"Allen, Deborah","If You're Not Gonna Love Me Right",CB60141,15,CB60141,,CB,1," 2/27/13"
"Allen, Deborah","Is It Love Yet",CB60170,7,CB60170,,CB,1," 2/27/13"
"Allman Brothers Band, The","I'm No Angel",SC8568,6,SC8568,,SC,1," 2/27/13"
"Allman Brothers Band, The","It's Not My Cross To Bear",SC8675,1,SC8675,,SC,1," 2/27/13"
"Amber Hayes","I Built This Wall",PHMC1302,6,PHMC1302,,PH,1," 2/27/13"
"Amen Corner","If Paradise Is Half As Nice",SF070,1,SF070,,SF,1," 2/27/13"
America,"I Need You",SC8231,4,SC8231,,SC,1," 2/27/13"
Anastasia,"I'm Outta Love",SC8607,7,SC8607,,SC,1," 2/27/13"
"Anderson, Bill","I Can't Wait Any Longer",SC8576,3,SC8576,,SC,1," 2/27/13"
"Anderson, Bill","I Get The Fever",SC8419,6,SC8419,,SC,1," 2/27/13"
"Anderson, Bill","If It's All The Same To You",CB90218,13,CB90218,,CB,1," 2/27/13"
"Anderson, Bill","If You Can Live With It (I Can Live With",CB90218,11,CB90218,,CB,1," 2/27/13"
"Anderson, John","I Fell In The Water",CB90092,15,CB90092,,CB,1," 2/27/13"
"Anderson, John","I Wish I Could Have Been There",CB60048,12,CB60048,,CB,1," 2/27/13"
"Anderson, John","I've Got It Made",SC8133,5,SC8133,,SC,1," 2/27/13"
"Anderson, John","It Ain't Easy Being Me",CB60221,2,CB60221,,CB,1," 2/27/13"
"Anderson, Lynn","If I Kiss You (Will You Go Away)",CB90114,3,CB90114,,CB,1," 2/27/13"
"Andreone, Leah","It's Alright It's Ok",PHM9703,9,PHM9703,,PH,1," 2/27/13"
"Andrews Sisters, The","I Wanna Be Loved",CBE4-01,3,CBE4-01,,CB,1," 2/27/13"
"Andrews, Jessica","I Do Now",MM6311,6,MM6311,,MM,1," 2/27/13"
"Andrews, Jessica","I Will Be There For You",SD061,14,SD061,,SD,1," 2/27/13"
"Andrews, Julie","I Could Have Danced All Night",SAVP08,10,SAVP08,,SA,1," 2/27/13"
"Andy Gibb","I Just Want To Be Your Everything",SC8181,15,SC8181,,SC,1," 2/27/13"
"Angelle, Lisa","I Wear Your Love",CB60183,13,CB60183,,CB,1," 2/27/13"
"Angelle, Lisa","I Will Love You",CB60214,15,CB60214,,CB,1," 2/27/13"
"Angie Stone","I Ain't Hearin' U",PHMU1002,3,PHMU1002,,PH,1," 2/27/13"
"Animals, The","I Put A Spell On You",DK030,17,DK030,,DK,1," 2/27/13"
"Animals, The","It's My Life",DK020,17,DK020,,DK,1," 2/27/13"
"Anka, Paul","It's Time To Cry",SC8521,14,SC8521,,SC,1," 2/27/13"
"Anka, Paul & Celine Dion","It's Hard To Say Goodbye",SC8523,8,SC8523,,SC,1," 2/27/13"
Annie,"It's A Hard Knock Life",CBE2-24,13,CBE2-24,,CB,1," 2/27/13"
"Anthony, Marc","I Need To Know",SGB030,15,SGB030,,SG,1," 2/27/13"
"Anthony, Marc","I Need You",SC8762,13,SC8762,,SC,1," 2/27/13"
"Anthony, Marc","I've Got You",CB30024,8,CB30024,,CB,1," 2/27/13"
"Anthony, Marc & Tina Arena","I Want To Spend My Life Loving You",PHM9810,3,PHM9810,,PH,1," 2/27/13"
"Anthony, Marc & Tina Arena","I Want To Spend My Lifetime Loving You",SC8481,8,SC8481,,SC,1," 2/27/13"
"Anthony, Marc wvocal","I Need To Know",PHM9911,11,PHM9911,,PH,1," 2/27/13"
"Anthony, Mark","I Need You",MM6363,3,MM6363,,MM,1," 2/27/13"
Anthrax,"I'm The Man",SC2364,3,SC2364,,SC,1," 2/27/13"
"Arden, Jann",Insensitive,SC8254,13,SC8254,,SC,1," 2/27/13"
Areosmith,"I Don't Want To Miss A Thing",SF124,11,SF124,,SF,1," 2/27/13"
"Aretha Franklin","I Say A Little Prayer",SF065,3,SF065,,SF,1," 2/27/13"
Armageddon,"I Don't Want To Miss A Thing",SC8635,15,SC8635,,SC,1," 2/27/13"
"Arnold, Eddy","I Really Don't Want To Know",SC8555,2,SC8555,,SC,1," 2/27/13"
"Arnold, Eddy","I Want To Go With You",CB80097,7,CB80097,,CB,1," 2/27/13"
"Arnold, Eddy","I Want to Go With You",SGB41,10,SGB41,,SG,1," 2/27/13"
"Arnold, Eddy","I Want To Go With You",CB60131,13,CB60131,,CB,1," 2/27/13"
"Arnold, Eddy","I'll Hold You In My Heart",SC8208,8,SC8208,,SC,1," 2/27/13"
"Ash Bowers","I Still Believe In That",PHMC1107,1,PHMC1107,,PH,1," 2/27/13"
"Asher Roth","I Love College",PHMP0905,1,PHMP0905,,PH,1," 2/27/13"
"Ataris, The","In This Diary",THMR0306,18,THMR0306,,TH,1," 2/27/13"
"Atkins, Chet","I Still Write Your Name In The Snow",SC8271,8,SC8271,,SC,1," 2/27/13"
"Atkins, Rodney","In A Heartbeat",SC8394,6,SC8394,,SC,1," 2/27/13"
"Atkins, Trace","I'm Tryin'",CB60221,15,CB60221,,CB,1," 2/27/13"
"Atlanta Rhythm Section, The","Imaginary Lover",SC8479,10,SC8479,,SC,1," 2/27/13"
"Atomic Kitten","If You Come To Me",SF211,3,SF211,,SF,1," 2/27/13"
"Atomic Kitten","It's Ok",MM6413,15,MM6413,,MM,1," 2/27/13"
Audioslave,"I Am The Highway",THR0401,13,THR0401,,TH,1," 2/27/13"
"August & The Spur Of The Moment Band","I-95 Song",SC8117,4,SC8117,,SC,1," 2/27/13"
"Austin, Patti","If We're Not In Love",SC8499,9,SC8499,,SC,1," 2/27/13"
"Austin, Sherrie","In The Meantime",CB60227,6,CB60227,,CB,1," 2/27/13"
"Austin, Sherrie","Innocent Man",CB60100,11,CB60100,,CB,1," 2/27/13"
"Autry, Gene","I Hang My Head And Cry",CB90219,4,CB90219,,CB,1," 2/27/13"
"Autry, Gene","I Want To Be Sure",CB90219,10,CB90219,,CB,1," 2/27/13"
"Autry, Gene","I Wish I Had Never Met Sunshine",CB90219,15,CB90219,,CB,1," 2/27/13"
"Autry, Gene","I'm Thinking Tonight Of My Blue Eyes",CB90219,3,CB90219,,CB,1," 2/27/13"
Avalon,"I Don't Want To Go",SC8828,9,SC8828,,SC,1," 2/27/13"
"Azar, Steve","I Don't Have To Be Me",SC8798,15,SC8798,,SC,1," 2/27/13"
"Azar, Steve","I Don't Have To Be Me 'til Monday",SD090,13,SD090,,SD,1," 2/27/13"
"Azar, Steve","I Never Stopped Lovin' You",SC8298,8,SC8298,,SC,1," 2/27/13"
"Baby Did A Bad Thing","Isaak, Chris",PHT9912,6,PHT9912,,PH,1," 2/27/13"
Babyface,"I Need A Love Song",PHMU0903,7,PHMU0903,,PH,1," 2/27/13"
"Babys, The","Isn't It Time",SC8456,11,SC8456,,SC,1," 2/27/13"
"Bachman, Tal","If You Sleep (Radio Version)",SC8595,15,SC8595,,SC,1," 2/27/13"
"Backstreet Boys","I Want It That Way",BL27,2,BL27,,BL,1," 2/27/13"
"Backstreet Boys","I'll Never Break Your Heart",SC1999NSC08,8,SC1999NSC08,,SC,1," 2/27/13"
"Backstreet Boys, The","I Want It That Way",CBE2-26,11,CBE2-26,,CB,1," 2/27/13"
"Backstreet Boys, The","I''ll Never Break Your Heart",SC8036,1,SC8036,,SC,1," 2/27/13"
"Backstreet Boys, The","I'll Never Break Your Heart",CBEP457-3,9,CBEP457-3,,CB,1," 2/27/13"
"Backstreet Boys, The wvocal","I Want It That Way",PHM9907,14,PHM9907,,PH,1," 2/27/13"
"Baker, Anita","I Apologize",SD010,7,SD010,,SD,1," 2/27/13"
"Ball, David","I Want To With You",CB20097,10,CB20097,,CB,1," 2/27/13"
Bananarama,"I Heard A Rumour",DK067,5,DK067,,DK,1," 2/27/13"
"Band, The","I Shall Be Released",DK077,7,DK077,,DK,1," 2/27/13"
"Bandy, Moe","I Cheated Me Right Out Of You",SC8342,15,SC8342,,SC,1," 2/27/13"
"Bandy, Moe","I'm Sorry For You My Friend",CB90117,9,CB90117,,CB,1," 2/27/13"
"Bandy, Moe","It Was Always So Easy",SC8525,8,SC8525,,SC,1," 2/27/13"
"Bandy, Moe","It Was Always So Easy (To Find An Unhapp",CB90117,12,CB90117,,CB,1," 2/27/13"
"Bandy, Moe","It's A Cheating Situation",SC8262,13,SC8262,,SC,1," 2/27/13"
"Bangles, The","If She Knew What She Wants",SC8535,1,SC8535,,SC,1," 2/27/13"
"Bangles, The","In Your Room",SC8329,3,SC8329,,SC,1," 2/27/13"
"Banks, Lloyd","I'm So Fly",PHU0411,2,PHU0411,,PH,1," 2/27/13"
"Banks, Lloyd wvocal","I'm So Fly",PHU0411,11,PHU0411,,PH,1," 2/27/13"
"Barbra Streisand & Bryan Adams","I Finally Found Someone",SC8369,9,SC8369,,SC,1," 2/27/13"
"Bare Naked Ladies","It's All Been Done",PHGH1900-6,7,PHGH1900-6,,PH,1," 2/27/13"
"Bare, Bobby","It's Alright",CB90118,7,CB90118,,CB,1," 2/27/13"
"Barenaked Ladies","If I Had $1,000,000",SGB038,9,SGB038,,SG,1," 2/27/13"
"Barenaked Ladies","If I Had $1000000",SC8640,6,SC8640,,SC,1," 2/27/13"
"Barenaked Ladies","If I Had A Million Dollars",CBE3-25,1,CBE3-25,,CB,1," 2/27/13"
"Barenaked Ladies","It's All Been Done",SC8640,7,SC8640,,SC,1," 2/27/13"
"Barnett, Mandy","I've Got A Right To Cry",SC8543,3,SC8543,,SC,1," 2/27/13"
"Barry, John","I Will If You Will",CM9706,20,CM9706,,CM,1," 2/27/13"
"Barton, Eileen","If I Knew You Were Comin' I'd've Baked",SC8415,8,SC8415,,SC,1," 2/27/13"
"Base, Rob","It Takes Two",SC8892,13,SC8892,,SC,1," 2/27/13"
"Base, Rob & D.J. E-Z Rock","It Takes Two",DK088,15,DK088,,DK,1," 2/27/13"
"Bates, Jeff","I Wanna Make You Cry",MM6406,9,MM6406,,MM,1," 2/27/13"
"Bay City Rollers, The","I Only Wanna Be With You",SC8292,15,SC8292,,SC,1," 2/27/13"
"Beach Boys","I Get Around",CBE3-17,11,CBE3-17,,CB,1," 2/27/13"
"Beach Boys, The","I Get Around",DK033,12,DK033,,DK,1," 2/27/13"
"Beastie Boys, The",Intergalactic,SC8894,7,SC8894,,SC,1," 2/27/13"
"Beatles, The","I Am The Walrus",MM6059,14,MM6059,,MM,1," 2/27/13"
"Beatles, The","I Call Your Name",DK043,4,DK043,,DK,1," 2/27/13"
"Beatles, The","I Feel Fine",DK004,17,DK004,,DK,1," 2/27/13"
"Beatles, The","I Saw Her Standing There",DK007,15,DK007,,DK,1," 2/27/13"
"Beatles, The","I Should Have Known Better",SC8360,15,SC8360,,SC,1," 2/27/13"
"Beatles, The","I Want To Be Your Man",DK034,3,DK034,,DK,1," 2/27/13"
"Beatles, The","I Want To Hold Your Hand",SC8379,15,SC8379,,SC,1," 2/27/13"
"Beatles, The","I Will",SC8575,4,SC8575,,SC,1," 2/27/13"
"Beatles, The","I'll Cry Instead",SC8360,13,SC8360,,SC,1," 2/27/13"
"Beatles, The","I'll Follow The Sun",SC8387,15,SC8387,,SC,1," 2/27/13"
"Beatles, The","I'm A Loser",SC8820,5,SC8820,,SC,1," 2/27/13"
"Beatles, The","I'm Down",SC8820,4,SC8820,,SC,1," 2/27/13"
"Beatles, The","I've Just Seen A Face",SC8685,13,SC8685,,SC,1," 2/27/13"
"Beatles, The","If I Fell",SC8360,11,SC8360,,SC,1," 2/27/13"
"Beatles, The","In My Life",DK005,9,DK005,,DK,1," 2/27/13"
"Beatles, The","It Won't Be Long",MM6059,4,MM6059,,MM,1," 2/27/13"
"Beatles, The","It's All Too Much",SC8820,7,SC8820,,SC,1," 2/27/13"
"BeBe & CeCe Winans","I Found Love (Cindy's Song)",PHMU1012,8,PHMU1012,,PH,1," 2/27/13"
"Beck, Jeff","I Ain't Superstitious",SC8675,9,SC8675,,SC,1," 2/27/13"
"Bedingfield, Daniel","I Can't Read You",SF204,5,SF204,,SF,1," 2/27/13"
"Bedingfield, Daniel","If You're Not The One",CB30037,11,CB30037,,CB,1," 2/27/13"
"Bedingfield, Daniel","If You're Not The One (Radio Version)",SC8827,8,SC8827,,SC,1," 2/27/13"
"Bedingfield, Daniel","If You're Not The Oneÿ",THP0305,11,THP0305,,TH,1," 2/27/13"
"Bee Gees","I've Gotta Get A Message To You",SC8804,1,SC8804,,SC,1," 2/27/13"
"Bee Gees, The","If I Can't Have You",SAVP34,8,SAVP34,,SA,1," 2/27/13"
"Belafonte, Harry","Island In The Sun",SF047,9,SF047,,SF,1," 2/27/13"
"Belinda Carlisle","In Too Deep",SC8389,12,SC8389,,SC,1," 2/27/13"
"Bellamy Brothers","I Need More Of You",CB90110,12,CB90110,,CB,1," 2/27/13"
"Bellamy Brothers","If I Said You Had A Beautiful Body",CB90110,2,CB90110,,CB,1," 2/27/13"
"Bellamy Brothers, The","I Could Be Persuaded",SC8161,9,SC8161,,SC,1," 2/27/13"
"Bellamy Brothers, The","I Need More Of You",SC2320,7,SC2320,,SC,1," 2/27/13"
"Bellamy Brothers, The","If I Said You Had A Beautiful Body",SC7590,15,SC7590,,SC,1," 2/27/13"
"Bellamy Brothers, The","If I Said You Have A Beautiful Body",SF014,6,SF014,,SF,1," 2/27/13"
"Bellamy Brothers, The wvocal","I Need More Of You",SC2320,14,SC2320,,SC,1," 2/27/13"
"Belle Stars, The","Iko Iko",SC8197,11,SC8197,,SC,1," 2/27/13"
"Belle, Regina","If I Could",SC2153,5,SC2153,,SC,1," 2/27/13"
"Benatar, Pat",Invincible,SC8815,5,SC8815,,SC,1," 2/27/13"
"Bennett, Tony","I Left My Heart In San Francisco",DK003,8,DK003,,DK,1," 2/27/13"
"Bennett, Tony","I Wanna Be Around",MMSTA2-1,12,MMSTA2-1,,MM,1," 2/27/13"
"Bennett, Tony","In The Middle Of An Island",MM6075,9,MM6075,,MM,1," 2/27/13"
"Bennett, Tony","It's A Sin To Tell A Lie",SAVP08,2,SAVP08,,SA,1," 2/27/13"
"Benton, Brook","It's Just A Matter Of Time",CBEP459-5,11,CBEP459-5,,CB,1," 2/27/13"
"Berg, Matraca","I Got It Bad",CB60099,15,CB60099,,CB,1," 2/27/13"
"Berg, Matraca","I Must Have Been Crazy",CB60101,9,CB60101,,CB,1," 2/27/13"
"Berry, John","I Think About It All The Time",SC8186,14,SC8186,,SC,1," 2/27/13"
"Berry, John","I Will If You Will",CHM9706,21,CHM9706,,CH,1," 2/27/13"
"Berry, John","I Will, If You Will",SC8376,13,SC8376,,SC,1," 2/27/13"
"Berry, John","If I Had Any Pride Left At All",SC8205,13,SC8205,,SC,1," 2/27/13"
"Better Than Ezra","In The Blood",SC8199,14,SC8199,,SC,1," 2/27/13"
Beyonce,"If I Were A Boy",PHMP0901,2,PHMP0901,,PH,1," 2/27/13"
"Bif Naked","I Love Myself Today",SC8800,14,SC8800,,SC,1," 2/27/13"
"Big Country","In A Big Country",SC8522,14,SC8522,,SC,1," 2/27/13"
"Big Daddy Weave","In Christ",CBE4-29,11,CBE4-29,,CB,1," 2/27/13"
"Big Sean","I Do It",PHMU1109,2,PHMU1109,,PH,1," 2/27/13"
"Big Time Operator","It Don't Mean A Thing",MMSTA2-5,14,MMSTA2-5,,MM,1," 2/27/13"
"Billy Ray Cyrus","I'm So Miserable",PHMC1302,8,PHMC1302,,PH,1," 2/27/13"
"Billy Swan","I Can Help",SF168,9,SF168,,SF,1," 2/27/13"
"Bishop, Stephen","It Might Be You",MM6098,1,MM6098,,MM,1," 2/27/13"
"Bishop, Stephen","It Might Be You (Tootsie)",SC8627,8,SC8627,,SC,1," 2/27/13"
"Bishops, The","I Need You More Today",CBEP466-1,6,CBEP466-1,,CB,1," 2/27/13"
Bjork,"It's Oh So Quiet",BL02,13,BL02,,BL,1," 2/27/13"
Bjork,"Its So Quiet",SF034,5,SF034,,SF,1," 2/27/13"
"Black Sabbath","Iron Man",SC8252,4,SC8252,,SC,1," 2/27/13"
"Black, Clint","I Raq And Roll",CB60309,14,CB60309,,CB,1," 2/27/13"
"Black, Clint","Iraq And Roll",PHN0306,3,PHN0306,,PH,1," 2/27/13"
Blackhawk,"I Need You All The Time",SD071,9,SD071,,SD,1," 2/27/13"
Blackhawk,"I Sure Can Smell The Rain",SD004,4,SD004,,SD,1," 2/27/13"
Blackhawk,"I'm Not Strong Enough To Say No",SC8189,9,SC8189,,SC,1," 2/27/13"
Blaque,"I Do",SC8613,11,SC8613,,SC,1," 2/27/13"
Blaque,"I'm Good",PHU0401,9,PHU0401,,PH,1," 2/27/13"
"Blessid Union Of Souls","I Believe",SC8164,4,SC8164,,SC,1," 2/27/13"
"Blessid Union Of Souls","I Wanna Be There",SC8381,15,SC8381,,SC,1," 2/27/13"
"Blessid Union Of Souls, The","I Believe",CBEP458-4,13,CBEP458-4,,CB,1," 2/27/13"
"Blessid Union Of Souls, The","I Wanna Be There",PHM9706,5,PHM9706,,PH,1," 2/27/13"
"Blige, Mary J","It's A Wrap",PHU0408,8,PHU0408,,PH,1," 2/27/13"
"Blink 182","I Miss You",PHR0404,7,PHR0404,,PH,1," 2/27/13"
"Blow Monkeys","It Doesn't Have To Be That Way",SF075,8,SF075,,SF,1," 2/27/13"
"Blue Highway","It's A Long, Long Road",CBEP476-6,10,CBEP476-6,,CB,1," 2/27/13"
"Bobbie Gentry","I'll Never Fall In Love Again",SF065,4,SF065,,SF,1," 2/27/13"
"Bobby Fuller Four, The","I Fought The Law",DK030,16,DK030,,DK,1," 2/27/13"
BoDeans,"If It Makes You",PHR0409,7,PHR0409,,PH,1," 2/27/13"
"BoDeans wvocal","If It Makes You",PHR0409,16,PHR0409,,PH,1," 2/27/13"
"Bogguss, Suzy","I'll Be Home For Christmas",CBEP462-6,7,CBEP462-6,,CB,1," 2/27/13"
"Bolton, Michael","I Found Someone",SC8277,13,SC8277,,SC,1," 2/27/13"
Bombalurina,"Itsy Bitsy Teenie Weenie",SF028,5,SF028,,SF,1," 2/27/13"
"Bon Jovi","I'll Be There For You",CBE3-22,13,CBE3-22,,CB,1," 2/27/13"
"Bon Jovi","In And Out Of Love",SC8631,7,SC8631,,SC,1," 2/27/13"
"Bon Jovi","It's My Life",SF165,16,SF165,,SF,1," 2/27/13"
"Bon Jovi, Jon","It's My Life",CB30006,7,CB30006,,CB,1," 2/27/13"
"Bonamy, James","I Don't Think I Will",SC8289,7,SC8289,,SC,1," 2/27/13"
"Bonnie Raitt","I Can't Make You Love Me",SC8107,15,SC8107,,SC,1," 2/27/13"
"Bonnie Tyler","It's A Heartache",SC8151,3,SC8151,,SC,1," 2/27/13"
"Boomtown Rats, The","I Don't Like Mondays",SC8571,10,SC8571,,SC,1," 2/27/13"
"Boone, Pat","I Almost Lost My Mind",CBEP454-2,7,CBEP454-2,,CB,1," 2/27/13"
"Boone, Pat","I'll Be Home",SAVP06,14,SAVP06,,SA,1," 2/27/13"
"Bow Wow Wow","I Want Candy",SC8329,10,SC8329,,SC,1," 2/27/13"
"Boxcar Racer","I Feel So",PHR0209,6,PHR0209,,PH,1," 2/27/13"
"Boyd, Jimmy","I Saw Mommy Kissing Santa Claus",CBEP462-3,13,CBEP462-3,,CB,1," 2/27/13"
"Boys Don't Cry","I Wanna Be A Cowboy",SC8522,9,SC8522,,SC,1," 2/27/13"
"Boys II Men","I'll Make Love To You",MMRB2-1,6,MMRB2-1,,MM,1," 2/27/13"
"Boys II Men","It's So Hard To Say Goodbye",MMRB2-3,11,MMRB2-3,,MM,1," 2/27/13"
"Boyz II Men","I Can't Make You Love Me",PHMU1002,4,PHMU1002,,PH,1," 2/27/13"
"Boyz Ii Men","I Remember",SC8248,13,SC8248,,SC,1," 2/27/13"
"Boyz Ii Men","I Will Get There",SC8523,7,SC8523,,SC,1," 2/27/13"
"Boyz Ii Men","I'll Make Love To You",SC8132,1,SC8132,,SC,1," 2/27/13"
"Boyz II Men","I'll Make Love To You",SD001,1,SD001,,SD,1," 2/27/13"
"Boyz Ii Men","I'll Make Love To You",CBEP458-2,6,CBEP458-2,,CB,1," 2/27/13"
"Boyz II Men","I'll Make Love To You",AH9821,8,AH9821,,AH,1," 2/27/13"
"Boyz Ii Men","I'll Make Love To You",BL27,15,BL27,,BL,1," 2/27/13"
"Boyz Ii Men","I'll Make You Love Me",SAVP20,1,SAVP20,,SA,1," 2/27/13"
"Boyz II Men","In The Still Of The Nite (I'll Remember)",SC8891,8,SC8891,,SC,1," 2/27/13"
"Boyz Ii Men","It's So Hard To Say Goodby",MMGCP9805,9,MMGCP9805,,MM,1," 2/27/13"
"Boyz Ii Men","It's So Hard To Say Goodbye",MMCP2K05,9,MMCP2K05,,MM,1," 2/27/13"
"Boyz II Men","It's So Hard To Say Goodbye To Yesterday",SC8891,15,SC8891,,SC,1," 2/27/13"
Boyzone,"I Love The Way You Love Me",SF127,16,SF127,,SF,1," 2/27/13"
"Brady Bunch, The","It's A Sunshine Day",SC8620,3,SC8620,,SC,1," 2/27/13"
"Brandt, Paul","I Do",MMGCOU01,19,MMGCOU01,,MM,1," 2/27/13"
"Brandt, Paul","I Meant To Do That",SC8341,13,SC8341,,SC,1," 2/27/13"
"Brandt, Paul","It's A Beautiful Thing",SC8570,15,SC8570,,SC,1," 2/27/13"
Brandy,"I Wanna Be Down",SC8150,2,SC8150,,SC,1," 2/27/13"
"Braxton, Toni","I Belong To You",MM6096,2,MM6096,,MM,1," 2/27/13"
"Braxton, Toni","I Don't Want To",MM6197,12,MM6197,,MM,1," 2/27/13"
"Braxton, Toni","I Don't Want You",SC8476,2,SC8476,,SC,1," 2/27/13"
"Braxton, Toni","I Love Me Some Him",SC8377,7,SC8377,,SC,1," 2/27/13"
Bread,If,CBEP463-1,15,CBEP463-1,,CB,1," 2/27/13"
Bread,"It Don't Matter To Me",CBEP464-1,3,CBEP464-1,,CB,1," 2/27/13"
"Brett Eldredge","It Ain't Gotta Be Love",PHMC1112,4,PHMC1112,,PH,1," 2/27/13"
"Brian Hyland","Itsy Bitsy Teeny Weenie Yellow Polka Dot",CBEP454-3,17,CBEP454-3,,CB,1," 2/27/13"
"Bridges, Alicia","I Love The Nightlife",MM6036,14,MM6036,,MM,1," 2/27/13"
"Bridges, Alicia","I Love The Nightlife (Disco 'round)",SC7597,15,SC7597,,SC,1," 2/27/13"
"Britney Spears","I Wanna Go",PHMP1106,4,PHMP1106,,PH,1," 2/27/13"
"Broadman Hymnal","I Am Resolved",CB70018,9,CB70018,,CB,1," 2/27/13"
"Broadman Hymnal","I Love To Tell The Story",CB70022,4,CB70022,,CB,1," 2/27/13"
"Broadman Hymnal","I Need Thee Every Hour",CB70019,16,CB70019,,CB,1," 2/27/13"
"Broadman Hymnal","I Was Glad When They Said",CB70022,13,CB70022,,CB,1," 2/27/13"
"Broadman Hymnal","I Will Sing The Wondrous Story",CB70022,5,CB70022,,CB,1," 2/27/13"
"Broadman Hymnal","I've Found A New Way",CB70022,15,CB70022,,CB,1," 2/27/13"
"Broadman Hymnal","If Jesus Said It",CB70023,9,CB70023,,CB,1," 2/27/13"
"Broadman Hymnal","In The Shelter Of His Arms",CB70023,5,CB70023,,CB,1," 2/27/13"
"Broadman Hymnal","It Is Well With My Soul",CB70018,1,CB70018,,CB,1," 2/27/13"
"Broadway-Show Tunes","Impossible Dream, The",DK079,15,DK079,,DK,1," 2/27/13"
"Broadway-Show Tunes","It Might As Well Be Spring",DK065,14,DK065,,DK,1," 2/27/13"
"Brock, Chad","It's A Woman Thing",CB60311,1,CB60311,,CB,1," 2/27/13"
"Brook Benton","It's Just A Matter Of Time",SC8196,15,SC8196,,SC,1," 2/27/13"
"Brooks & Dunn","I Am That Man",MMGCOU04,12,MMGCOU04,,MM,1," 2/27/13"
"Brooks & Dunn","I Can't Get Over You",SC8512,14,SC8512,,SC,1," 2/27/13"
"Brooks & Dunn","I'll Never Forgive My Heart",CB90006,14,CB90006,,CB,1," 2/27/13"
"Brooks & Dunn","If That's The Way You Want It",SC8296,1,SC8296,,SC,1," 2/27/13"
"Brooks & Dunn","If You See Him, If You See Her",CBEP461-3,5,CBEP461-3,,CB,1," 2/27/13"
"Brooks & Dunn","It's Getting Better All The Time",SC8907,1,SC8907,,SC,1," 2/27/13"
"Brooks & Dunn & Mcentire, Reba","If You See Him & If You See Her",SC7588,14,SC7588,,SC,1," 2/27/13"
"Brooks & Dunn & Reba","If You See Him If You See Her",CHM9808,12,CHM9808,,CH,1," 2/27/13"
"Brooks, Garth","I Don't Have To Wonder",CB60199,6,CB60199,,CB,1," 2/27/13"
"Brooks, Garth","If Tomorrow Never Comes",CB60028,9,CB60028,,CB,1," 2/27/13"
"Brooks, Garth","In Another's Eyes",SGB24,9,SGB24,,SG,1," 2/27/13"
"Brooks, Garth","Ireland 99",CHT9905,1,CHT9905,,CH,1," 2/27/13"
"Brooks, Garth","It Don't Matter To The Sun",SD066,14,SD066,,SD,1," 2/27/13"
"Brooks, Garth","It's Midnight Cinderella",SC8247,10,SC8247,,SC,1," 2/27/13"
"Brooks, Garth","It's Your Song",CB90015,13,CB90015,,CB,1," 2/27/13"
"Brooks, Garth & Trisha Yearwood","In Another's Eyes",CHM9710,12,CHM9710,,CH,1," 2/27/13"
"Brooks, Garth (As Chris Gaines)","It Don't Matter To The Sun",SC8566,1,SC8566,,SC,1," 2/27/13"
"Brooks, Garth (Chris Gaines)","It Don't Matter To The Sun",SGB029,1,SGB029,,SG,1," 2/27/13"
"Brooks, Meredith","I Need",SC8395,11,SC8395,,SC,1," 2/27/13"
"Brother Cane","I Lie In The Bed I Make",SC8465,7,SC8465,,SC,1," 2/27/13"
"Brown & Cornelius","I Don't Want To Have To Marry You",MM6314,4,MM6314,,MM,1," 2/27/13"
"Brown, James","I Got You (I Feel Good)",DK087,15,DK087,,DK,1," 2/27/13"
"Brown, James","I'll Go Crazy",SC8339,11,SC8339,,SC,1," 2/27/13"
"Brown, Shannon","I Won't Lie",SC8498,12,SC8498,,SC,1," 2/27/13"
"Brown, T. Graham","I Tell It Like It Used To Be",SC8380,14,SC8380,,SC,1," 2/27/13"
"Brown, T. Graham","If You Could Only See Me Now",SC8359,15,SC8359,,SC,1," 2/27/13"
"Brown, T. Graham","If You Could See Me Now",CB60096,15,CB60096,,CB,1," 2/27/13"
"Browne, Jackson","I'm The Cat",SC8316,4,SC8316,,SC,1," 2/27/13"
"Browne, Jann","It Only Hurts When I Laugh",CB60141,2,CB60141,,CB,1," 2/27/13"
Brownstone,"If You Love Me",SC8150,10,SC8150,,SC,1," 2/27/13"
"Brutha Feat Fabolous","I Can't Hear The Music",PHMU0904,9,PHMU0904,,PH,1," 2/27/13"
"Bryson, Peabo","If Ever You're In My Arms Again",MMRB2-1,18,MMRB2-1,,MM,1," 2/27/13"
