"Troccoli, Kathy","You've Got A Way",MM6008,12,MM6008,MM,1," 2/27/13"
"Tucker, Tanya","You Just Watch Me",SC8137,14,SC8137,SC,1," 2/27/13"
"Turtles, The","You Showed Me",SC8429,10,SC8429,SC,1," 2/27/13"
"Twain, Shania","You Lay A Whole Lot Of Love On Me",SC2039,3,SC2039,SC,1," 2/27/13"
"Twain, Shania","You Win My Love",MMCOU204,14,MMCOU204,MM,1," 2/27/13"
"Twain, Shania","You're Still The One",MMCOU202,20,MMCOU202,MM,1," 2/27/13"
"Twain, Shania","You've Got A Way",CB60178,7,CB60178,CB,1," 2/27/13"
"Twitty, Conway","You've Never Been This Far Before",SC8372,15,SC8372,SC,1," 2/27/13"
"Urban, Keith","You'll Think Of Me",MM6407,1,MM6407,MM,1," 2/27/13"
"Urban, Keith","You're My Better Half",PHN0501,8,PHN0501,PH,1," 2/27/13"
"Urban, Keith","Your Everything",CHM0006,18,CHM0006,CH,1," 2/27/13"
"Urban, Keith","You'll Think Of Me",SC8877,7,SC8877,SC,1," 2/27/13"
"Urban, Keith wvocal","You'll Think Of Me",SC3404,9,SC3404,SC,1," 2/27/13"
Usher,"You Don't Have To Call",SC8799,7,SC8799,SC,1," 2/27/13"
Usher,"You Got It Bad",SC8799,15,SC8799,SC,1," 2/27/13"
Usher,"You Make Me Wanna",SC8462,15,SC8462,SC,1," 2/27/13"
Usher,"You Remind Me",SGB65,10,SGB65,SG,1," 2/27/13"
"Usher & Lil Jon & Ludicris",Yeah,MM6408,1,MM6408,MM,1," 2/27/13"
"Usher & Ludacris",Yeah,PHU0404,1,PHU0404,PH,1," 2/27/13"
"Usher & Ludacris & Lil Jon",Yeah,SC8902,4,SC8902,SC,1," 2/27/13"
"Usher & Ludacris & Lil' Jon",Yeah,SC8864,4,SC8864,SC,1," 2/27/13"
"Van Halen","You Really Got Me",SGB14,9,SGB14,SG,1," 2/27/13"
"Vandross, Luther","Your Secret Love",SC8320,7,SC8320,SC,1," 2/27/13"
"Various Artists","You're A Mean One Mr. Grinch",CBEP462-3,16,CBEP462-3,CB,1," 2/27/13"
"Vedder, Eddie","You've Got To Hide Your Love",PHR0204,8,PHR0204,PH,1," 2/27/13"
"Vedder, Eddie","You've Got To Hide Your Love Away",MM6359,5,MM6359,MM,1," 2/27/13"
"Velasquez, Jaci","You're My God",CBE4-29,8,CBE4-29,CB,1," 2/27/13"
"Vertical Horizon","You're A God",CB30006,15,CB30006,CB,1," 2/27/13"
"Village People, The",Y.m.c.a.,CBE22,1,CBE22,CB,1," 2/27/13"
"Village People, The",Y.M.C.A.,MM6135,3,MM6135,MM,1," 2/27/13"
"Village People, The",Y.m.c.a.,SC7511,11,SC7511,SC,1," 2/27/13"
"Village People, The",Y.M.C.A.,SF028,13,SF028,SF,1," 2/27/13"
"Village People, The",Y.m.c.a.,SAVP09,16,SAVP09,SA,1," 2/27/13"
"Village People, The",Ymca,BL01,6,BL01,BL,1," 2/27/13"
"Vogues, The","You're The One",SC8521,2,SC8521,SC,1," 2/27/13"
"Wagoner, Porter","Y'all Come",CB90087,1,CB90087,CB,1," 2/27/13"
"Wagoner, Porter","Your Old Love Letters",CB90087,10,CB90087,CB,1," 2/27/13"
"Wagoner, Porter & Dolly Parton","Your Love",CB90083,9,CB90083,CB,1," 2/27/13"
"Walker, Clay","You're Beginning To Get To Me",CB90007,15,CB90007,CB,1," 2/27/13"
"Wariner, Steve","You Can Dream Of Me",SC7556,6,SC7556,SC,1," 2/27/13"
"Warwick, Dionne","You'll Never Get To Heaven (If You Break",SC8651,8,SC8651,SC,1," 2/27/13"
"Watson, Gene","You Could Know As Much About A Stranger",CB90081,7,CB90081,CB,1," 2/27/13"
"Watson, Gene","You Gave Me A Mountain",SC8324,8,SC8324,SC,1," 2/27/13"
"Watson, Gene","You're Out Doing What I'm Here Doing Wit",CB90081,11,CB90081,CB,1," 2/27/13"
"Wayne, Jimmy","You Are",PHN0410,9,PHN0410,PH,1," 2/27/13"
"We Five","You Were On My Mind",DK021,17,DK021,DK,1," 2/27/13"
"Wells, Kitty","You Don't Hear",SC8367,3,SC8367,SC,1," 2/27/13"
"Wells, Mary","You Beat Me To The Punch",DK077,12,DK077,DK,1," 2/27/13"
"West, Dottie","You're Not Easy To Forget",CB90085,6,CB90085,CB,1," 2/27/13"
"West, Shelley & David Frizzell","You're The Reason God Made Oklahoma",CBEP471-6,7,CBEP471-6,CB,1," 2/27/13"
"Wherever I Lay My Hat","Young, Paul",PX14,5,PX14,PX,1," 2/27/13"
"White Town","Your Woman",SC8377,13,SC8377,SC,1," 2/27/13"
"White, Barry","You See The Trouble With Me",BL25,5,BL25,BL,1," 2/27/13"
"White, Barry","You're My First, My Last, My Everything",MMRB2-5,17,MMRB2-5,MM,1," 2/27/13"
"White, Barry","You're The First, The Last, My Everythin",CBEP468-1,17,CBEP468-1,CB,1," 2/27/13"
"White, Bryan","You're Still Beautiful To Me",CB60178,13,CB60178,CB,1," 2/27/13"
"Whitney Houston","You Give Good Love",SC8362,14,SC8362,SC,1," 2/27/13"
"Who, The","You Better You Bet",SC8586,7,SC8586,SC,1," 2/27/13"
Wilco,"You Never Know",PHMP0910,5,PHMP0910,PH,1," 2/27/13"
"Wild Horses","You Gotta Ride",CB60247,15,CB60247,CB,1," 2/27/13"
"Wilde, Kim","You Keep Me Hanging On",MM6042,11,MM6042,MM,1," 2/27/13"
"Wilkinsons, The","Yodelin' Blues, The",CB60174,15,CB60174,CB,1," 2/27/13"
"Williams & Chayanne","You Are My Home",SC8484,13,SC8484,SC,1," 2/27/13"
"Williams, Don","You're My Best Friend",SC8424,10,SC8424,SC,1," 2/27/13"
"Williams, Hank","Your Cheatin' Heart",DK010,17,DK010,DK,1," 2/27/13"
"Williams, Hank Sr.","You Win Again",CB90067,5,CB90067,CB,1," 2/27/13"
"Williams, Hank Sr.","You're Gonna Change Or I'm Gonna Leave",CB90067,13,CB90067,CB,1," 2/27/13"
"Williams, Vanessa","You Can't Run",SC8209,6,SC8209,SC,1," 2/27/13"
"Williams, Vanessa & Chayanne","You Are My Home",SC2187,6,SC2187,SC,1," 2/27/13"
"Wills, Mark","Your Own Little Corner Of My Heart",CB20069,11,CB20069,CB,1," 2/27/13"
"Wilson Phillips","You Won't See Me Cry",MM6027,10,MM6027,MM,1," 2/27/13"
"Wilson Phillips","You're In Love",SC8363,5,SC8363,SC,1," 2/27/13"
"Wilson, Brian","Your Imagination",SC8473,9,SC8473,SC,1," 2/27/13"
"Wilson, Jackie","Your Love Keeps Lifting Me Higher And Hi",CBEP459-5,2,CBEP459-5,CB,1," 2/27/13"
"Womack, Lee Ann","You've Got To Talk To Me",CHM9801,19,CHM9801,CH,1," 2/27/13"
"Wonder, Stevie","Yester Me Yester You Yesterday",CBEP459-1,7,CBEP459-1,CB,1," 2/27/13"
"Wonder, Stevie","Yester Me, Yester You, Yesterday",MMRB04,3,MMRB04,MM,1," 2/27/13"
"Wonder, Stevie","Yester-Me Yester-You Yesterday",BL34,12,BL34,BL,1," 2/27/13"
"Wonder, Stevie","You Are The Sunshine Of My Life",MMRB05,18,MMRB05,MM,1," 2/27/13"
"Wonder, Stevie","You Make Me Feel Like Dancing",CBEP474-3,1,CBEP474-3,CB,1," 2/27/13"
"Wood, Jeff","You Just Get One",CB60007,7,CB60007,CB,1," 2/27/13"
"Wright, Michelle & Jim Brickman","Your Love",CB60196,5,CB60196,CB,1," 2/27/13"
"Wynette, Tammy","You And Me",CB80110,11,CB80110,CB,1," 2/27/13"
"Wynette, Tammy","Your Good Girl's Gonna Go Bad",CBEP451-6,7,CBEP451-6,CB,1," 2/27/13"
"Yankovic, Weird Al",Yoda,SGB23,17,SGB23,SG,1," 2/27/13"
"Yankovic, Weird Al","You Don't Love Me Anymore",SC2220,1,SC2220,SC,1," 2/27/13"
"Yearwood, Trisha","You Can Sleep While I Drive",SD016,14,SD016,SD,1," 2/27/13"
"Yearwood, Trisha","You Done Me Wrong",MM6011,15,MM6011,MM,1," 2/27/13"
"Yearwood, Trisha","You Say You Will",MM6022,12,MM6022,MM,1," 2/27/13"
"Yearwood, Trisha","You're Where I Belong",SC8590,7,SC8590,SC,1," 2/27/13"
"Yoakam, Dwight","You're The One",SC7569,3,SC7569,SC,1," 2/27/13"
"Young, Faron","You're Still Mine",CB90217,7,CB90217,CB,1," 2/27/13"
"Young, Faron","Your Old Used To Be",CB90217,13,CB90217,CB,1," 2/27/13"
"Young, Will","You And I",SF199,16,SF199,SF,1," 2/27/13"
