"Judas Priest","You've Got Another Thing Comin'",SC8252,8,SC8252,SC,1," 2/27/13"
"Judds, The","Young Love",CB90010,15,CB90010,CB,1," 2/27/13"
"K-Ci & Jojo","You Bring Me Up",SC8390,3,SC8390,SC,1," 2/27/13"
"K.C. & The Sunshine Band","Yes, I Am Ready",CB90192,8,CB90192,CB,1," 2/27/13"
"Keith, Toby","You Ain't Much Fun",CBE12,15,CBE12,CB,1," 2/27/13"
"Keith, Toby","You Shouldn't Kiss Me Like This",SC8655,15,SC8655,SC,1," 2/27/13"
"Kelly, R.","You Remind Me Of Something",SC8220,15,SC8220,SC,1," 2/27/13"
Kem,"You're On My Mind",PHMU1204,2,PHMU1204,PH,1," 2/27/13"
"Kendalls, The","You'd Make An Angel Wanna Cheat",SC7570,1,SC7570,SC,1," 2/27/13"
"Kenny Lattimore","You Are My Starship",PHMU0812,7,PHMU0812,PH,1," 2/27/13"
"Kershaw, Sammy","Yard Sale",CB60106,13,CB60106,CB,1," 2/27/13"
"Kershaw, Sammy","Your Tattoo",SC8194,12,SC8194,SC,1," 2/27/13"
"Keys, Alicia","You Don't Know My Name",SC8858,15,SC8858,SC,1," 2/27/13"
"Keys, Alicia","You Dont Know My Name",SF212,11,SF212,SF,1," 2/27/13"
"Keys, Alicia","You Don't Know My Name",SC8902,8,SC8902,SC,1," 2/27/13"
"Keyshia Cole","You Complete Me",PHMU0903,3,PHMU0903,PH,1," 2/27/13"
"King, Carole","You've Got A Friend",CBE3-18,5,CBE3-18,CB,1," 2/27/13"
"Kinks, The","You Really Got Me",MMOLD01,18,MMOLD01,MM,1," 2/27/13"
"Kinley's, The","You're Still Here",CB60221,9,CB60221,CB,1," 2/27/13"
"Kinleys, The","You Make It Seem So Easy",CB60100,13,CB60100,CB,1," 2/27/13"
"Kinleys, The","You're Still Here",PHN0109,7,PHN0109,PH,1," 2/27/13"
Kiss,"You Wanted The Best",SC8515,9,SC8515,SC,1," 2/27/13"
"Krall, Diana","You're Getting To Be A Habit With Me",MM6334,6,MM6334,MM,1," 2/27/13"
Lace,"You Could've Had Me",CB60199,5,CB60199,CB,1," 2/27/13"
"Lattimore, Lennyÿ& Chante Moore","You Don't Have To Cry",CB30038,4,CB30038,CB,1," 2/27/13"
"Led Zeppelin","Your Time Is Gonna Come",SC8674,15,SC8674,SC,1," 2/27/13"
"Lee, Brenda","You Can Depend On Me",CBEP455-3,6,CBEP455-3,CB,1," 2/27/13"
"Leighton Meester","Your Love's A Drug",PHMP1006,7,PHMP1006,PH,1," 2/27/13"
"Lewis, Jerry Lee","You Win Again",CB90082,2,CB90082,CB,1," 2/27/13"
"Limmie & The Family Cooking","You Can Do Magic",SF101,1,SF101,SF,1," 2/27/13"
"Lines, Aaron","You Can't Hide Beautiful",CB60241,4,CB60241,CB,1," 2/27/13"
"Little Texas","You And Forever And Me",SC8502,9,SC8502,SC,1," 2/27/13"
"Locklin, Hank","You're The Reason",CB90220,13,CB90220,CB,1," 2/27/13"
"Loggins & Messina","Your Mama Don't Dance",SC7203,15,SC7203,SC,1," 2/27/13"
Lonestar,"You Walked In",CHM9712,16,CHM9712,CH,1," 2/27/13"
"Love Inc","You're A Superstar",SF201,5,SF201,SF,1," 2/27/13"
"Loveless, Patty","You Can Feel Bad",SC8232,14,SC8232,SC,1," 2/27/13"
"Loveless, Patty","You Don't Even Know Who I Am",DK1106,7,DK1106,DK,1," 2/27/13"
"Loveless, Patty","You Don't Seem To Miss Me",MMCOU203,17,MMCOU203,MM,1," 2/27/13"
"Loveless, Patty","You Will",MM6039,15,MM6039,MM,1," 2/27/13"
"Lovin' Spoonful","You Didn't Have To Be So Nice",CBEP472-3,11,CBEP472-3,CB,1," 2/27/13"
"Lovin' Spoonful, The","You Didn't Have To Be So Nice",SC8599,1,SC8599,SC,1," 2/27/13"
"Luke Bryan","You Don't Know Jack",PHMC1111,7,PHMC1111,PH,1," 2/27/13"
"Luther, Bill","You Will Always Be Mine",CB60216,5,CB60216,CB,1," 2/27/13"
"Lynn, Barbara","You'll Lose A Good Thing",MMRB05,20,MMRB05,MM,1," 2/27/13"
"Lynn, Loretta","You Ain't Woman Enough To Take My Man",SC7537,15,SC7537,SC,1," 2/27/13"
"Lynn, Loretta","You're Lookin' At Country",CBE3-01,13,CBE3-01,CB,1," 2/27/13"
"Lynn, Loretta","You're Looking At Country",SC2275,7,SC2275,SC,1," 2/27/13"
"Lynn, Loretta","You've Just Stepped In From Stepping Out",CB90073,13,CB90073,CB,1," 2/27/13"
"Lynn, Loretta","Your Squaw Is On The Warpath",SC8367,1,SC8367,SC,1," 2/27/13"
"Lynn, Loretta wvocal","You Ain't Woman Enough To Take My Man",SC2275,10,SC2275,SC,1," 2/27/13"
"Lynn, Loretta wvocal","You're Looking At Country",SC2275,15,SC2275,SC,1," 2/27/13"
"Lynyrd Skynyrd","You Got That Right",SC8459,6,SC8459,SC,1," 2/27/13"
Madonna,"You Must Love Me",SC8340,9,SC8340,SC,1," 2/27/13"
Madonna,"You'll See",SF041,13,SF041,SF,1," 2/27/13"
"Manchester, Melissa","You Should Hear How She Talks About You",SC8417,8,SC8417,SC,1," 2/27/13"
"Mandrell, Barbara",Years,CB90102,12,CB90102,CB,1," 2/27/13"
"Marc Anthony","You Sang To Me",SGB42,11,SGB42,SG,1," 2/27/13"
"Marshall Dyllon",You,CB60215,14,CB60215,CB,1," 2/27/13"
"Martin, Billy Ray","Your Loving Arms",SC8312,6,SC8312,SC,1," 2/27/13"
"Martin, Dean","You Belong To Me",MM6419-2,20,MM6419-2,MM,1," 2/27/13"
"Martin, Dean","You're Nobody 'til Somebody Loves You",CBE4-01,9,CBE4-01,CB,1," 2/27/13"
"Martin, Dean","You're Nobody 'till Somebody Loves You",SC7540,8,SC7540,SC,1," 2/27/13"
"Martin, Dean","You're Nobody 'Till Somebody Loves You",DK092,15,DK092,DK,1," 2/27/13"
"Martin, Dean","You're Nobody Till Somebody Loves You",MMSTA2-2,17,MMSTA2-2,MM,1," 2/27/13"
"Martin, Ricky","You Stay With Me",SGB13,13,SGB13,SG,1," 2/27/13"
"Mason, Barbara","Yes I'm Ready",CBEP459-3,16,CBEP459-3,CB,1," 2/27/13"
"Matt Kennon","You Can Still Wear White",PHMC1010,7,PHMC1010,PH,1," 2/27/13"
"Mattea, Kathy","You're The Power",SC8604,4,SC8604,SC,1," 2/27/13"
"Mayer, John","Your Body Is A Wonderland",THP0212,16,THP0212,TH,1," 2/27/13"
"Mayer, John wvocal","Your Body Is A Wonderland",SC3332,16,SC3332,SC,1," 2/27/13"
"Mccann, Lila","Yippy Ky Yay",SC8470,13,SC8470,SC,1," 2/27/13"
"McCann, Lila","Yippy Ky Yay",SD053,13,SD053,SD,1," 2/27/13"
"McComas, Brian","You're In My Head",MM6402,11,MM6402,MM,1," 2/27/13"
"Mccomas, Brian","You're In My Head",THC0401,18,THC0401,TH,1," 2/27/13"
"McCoo, Marilyn  & Billy Davis Jr.","You Don't Have To Be A Star",CBEP474-3,5,CBEP474-3,CB,1," 2/27/13"
"Mccoo, Marilyn & Billy Davis Jr.","You Don't Have To Be A Star (To Be In My",CBEP471-1,11,CBEP471-1,CB,1," 2/27/13"
"McCoo, Marilyn & Billy Davis, Jr.","You Don'T Have To Be A Star (To Be In My",SC8863,8,SC8863,SC,1," 2/27/13"
"Mccoy, Neal","You Gotta Love That",CB90057,14,CB90057,CB,1," 2/27/13"
"McCoy, Neal","You Gotta Love That",SD024,14,SD024,SD,1," 2/27/13"
"McCready, Mindy","You'll Never Know",SD047,6,SD047,SD,1," 2/27/13"
"Mccready, Mindy","You'll Never Know",CHM9804,17,CHM9804,CH,1," 2/27/13"
"McDonald, Jane","You're My World",SF145,6,SF145,SF,1," 2/27/13"
"Mcdowell, Ronnie","You're Gonna Ruin My Bad Reputation",DK060,13,DK060,DK,1," 2/27/13"
"Mcentire, Reba","You Lie",MMBK08,14,MMBK08,MM,1," 2/27/13"
"Mcentire, Reba","You Lift Me Up To Heaven",SC8411,7,SC8411,SC,1," 2/27/13"
"Mcentire, Reba","You're The First Time I Thought About Le",SC8375,8,SC8375,SC,1," 2/27/13"
"McGraw, Tim","You Turn Me On",MM6235,15,MM6235,MM,1," 2/27/13"
Meatloaf,"You Took The Words Right Out Of My Mouth",MM6042,14,MM6042,MM,1," 2/27/13"
"Mellencamp, John","Your Life Is Now",SC8487,14,SC8487,SC,1," 2/27/13"
"Mellencamp, John","Yours Forever (The Perfect Storm)",SC8625,8,SC8625,SC,1," 2/27/13"
"Mellencamp, John Cougar","Yours Forever (The Perfect Storm)",SC3208,8,SC3208,SC,1," 2/27/13"
"Mena, Maria","You're The Only One",MM6417,10,MM6417,MM,1," 2/27/13"
"Merrill, Helen","You'd Be So Nice To Come Home To",SAVP12,12,SAVP12,SA,1," 2/27/13"
"Messina, Jo Dee","You're Not In Kansas Anymore",SC8307,15,SC8307,SC,1," 2/27/13"
"Michael Bolton",Yesterday,SC8374,11,SC8374,SC,1," 2/27/13"
"Michael, George","You Have Been Loved",SF114,8,SF114,SF,1," 2/27/13"
"Miller, Mitch","Yellow Rose Of Texas, The",SC8196,14,SC8196,SC,1," 2/27/13"
"Miller, Mitch","You Are My Sunshine",CBEP469-3,6,CBEP469-3,CB,1," 2/27/13"
"Miller, Roger","You Can't Rollerskate In A Buffalo Herd",CB60134,13,CB60134,CB,1," 2/27/13"
"Miracles, The","You've Really Got A Hold On Me",MMRB05,10,MMRB05,MM,1," 2/27/13"
"Mitchell, Joni","You Turn Me On",SC8410,1,SC8410,SC,1," 2/27/13"
"Mona Lisa","You Said",SC8304,5,SC8304,SC,1," 2/27/13"
"Montgomery Gentry","You Do Your Thing",SC8881,14,SC8881,SC,1," 2/27/13"
"Montgomery Gentry wvocal","You Do Your Thing",SC3416,10,SC3416,SC,1," 2/27/13"
"Montgomery, John Michael","You Are",CBEP463-6,15,CBEP463-6,CB,1," 2/27/13"
"Moody Blues","Your Wildest Dreams",SC1999NSC07,13,SC1999NSC07,SC,1," 2/27/13"
"Moody Blues, The","Your Wildest Dream",SC8725,2,SC8725,SC,1," 2/27/13"
"Morgan, Lorrie","You'd Think He'd Know Me Better",SC8474,15,SC8474,SC,1," 2/27/13"
"Morissette, Alanis","You Learn",SC8290,11,SC8290,SC,1," 2/27/13"
"Morissette, Alanis","You Oughta Know",AH8006,16,AH8006,AH,1," 2/27/13"
"Morris, Lynn","You'll Get No More Of Me",CBEP476-3,14,CBEP476-3,CB,1," 2/27/13"
"Morrison, Van & Gail Lewis","You Win Again",CB60218,14,CB60218,CB,1," 2/27/13"
"Morrison, Van & Linda Gail Lewis","You Win Again",CBEP471-5,3,CBEP471-5,CB,1," 2/27/13"
"Mraz, Jason","You & I Both",MM6405,10,MM6405,MM,1," 2/27/13"
"Mraz, Jason","You And I Both",THP0401,18,THP0401,TH,1," 2/27/13"
"Mullins & Black","You Didn't Did Ya",CB60183,8,CB60183,CB,1," 2/27/13"
Murmurs,"You Suck",SC8562,4,SC8562,SC,1," 2/27/13"
"Murray, Anne","You Needed Me",CB90101,13,CB90101,CB,1," 2/27/13"
"Needle And Damage Done","Young, Neil",AMS1507,4,AMS1507,AM,1," 2/27/13"
"Neil, Vince","You're Invited (But Your Friend Can't Co",SC8843,8,SC8843,SC,1," 2/27/13"
"Nelson, Ricky","Young World",CB90207,15,CB90207,CB,1," 2/27/13"
"Neon Trees","Your Surrender",PHMP1106,5,PHMP1106,PH,1," 2/27/13"
"New Kids On The Block","You Got It (The Right Stuff)",SAVP24,18,SAVP24,SA,1," 2/27/13"
"New Politics","Yeah Yeah Yeah",PHMP1010,5,PHMP1010,PH,1," 2/27/13"
"New Radicals","You Get What You Give",SC8501,7,SC8501,SC,1," 2/27/13"
"New Seekers, The","You Won't Find Another Fool Like Me",SF101,5,SF101,SF,1," 2/27/13"
"Newton, Juice","You Make Me Want To Make You Mine",CB60169,15,CB60169,CB,1," 2/27/13"
"Newton-John, Olivia & John Travolta","You're The One That I Want",BL01,4,BL01,BL,1," 2/27/13"
"Nicki Minaj","Your Love",PHMU1007,4,PHMU1007,PH,1," 2/27/13"
"Night Ranger","You Can Still Rock In America",SC8624,1,SC8624,SC,1," 2/27/13"
Nirvana,"You Know You're Right",CBEP477-1,17,CBEP477-1,CB,1," 2/27/13"
"Nitty Gritty Dirt Band, The","You Made Life Good Again",CB60156,15,CB60156,CB,1," 2/27/13"
"Oak Ridge Boys","Y'all Come Back Saloon",CB90108,10,CB90108,CB,1," 2/27/13"
"Oak Ridge Boys","You're My Soul And Inspiration",CB90108,9,CB90108,CB,1," 2/27/13"
"Oak Ridge Boys","You're The One",CB90108,11,CB90108,CB,1," 2/27/13"
"Oak Ridge Boys, The","Y'all Come Back Saloon",CBE4-16,9,CBE4-16,CB,1," 2/27/13"
"Oak Ridge Boys, The","You're My Soul And Inspiraton",CB60128,15,CB60128,CB,1," 2/27/13"
"Ocean Colour Scene","You've Got It Bad",SF049,9,SF049,SF,1," 2/27/13"
"Ohio Express, The","Yummy Yummy Yummy",SC8191,2,SC8191,SC,1," 2/27/13"
"One Block Radius","You Got Me",PHMP0810,3,PHMP0810,PH,1," 2/27/13"
"Orbison, Roy","You Got It",SC8273,4,SC8273,SC,1," 2/27/13"
"Osbourne, Ozzy","You Can't Kill Rock And Roll",SC8869,13,SC8869,SC,1," 2/27/13"
Outfield,"Your Love",SC8447,12,SC8447,SC,1," 2/27/13"
"P O D","Youth Of A Nation",CB30022,15,CB30022,CB,1," 2/27/13"
P.o.d.,"Youth Of A Nation",CBE3-28,10,CBE3-28,CB,1," 2/27/13"
P.o.d.,"Youth Of The Nation",SC8740,14,SC8740,SC,1," 2/27/13"
"Parnell, Leroy","You Can't Get There From Here",CHM9711,18,CHM9711,CH,1," 2/27/13"
"Parton, Dolly","Yellow Roses",SC8230,6,SC8230,SC,1," 2/27/13"
"Parton, Dolly","You're The Only One",SC8411,13,SC8411,SC,1," 2/27/13"
"Paul Anka & Odia Coates","You're Having My Baby",SC8679,8,SC8679,SC,1," 2/27/13"
"Peem, Dawn","You Don't Love Me",SF020,13,SF020,SF,1," 2/27/13"
"Pennington, J.p.","You Gotta Get Serious",CB60151,7,CB60151,CB,1," 2/27/13"
"Perfect Stranger","You Have The Right To Remain Silent",SC8186,15,SC8186,SC,1," 2/27/13"
"Perry Sisters, The","You Are The Potter",CBEP466-4,12,CBEP466-4,CB,1," 2/27/13"
"Perry, Steve","You Better Wait",SC8235,13,SC8235,SC,1," 2/27/13"
"Peters, Red","You Promised The Moon But I Preferred Ur",SC8700,7,SC8700,SC,1," 2/27/13"
"Petty, Tom","You Don't Know How It Feels",SF020,10,SF020,SF,1," 2/27/13"
"Petty, Tom & The Heartbreakers","You Don't Know How It Feels",SC8150,15,SC8150,SC,1," 2/27/13"
"Petty, Tom & The Heartbreakers","You Got Lucky",SC7561,3,SC7561,SC,1," 2/27/13"
"Phillips, Craig & Dean","You Are My King",SC8828,6,SC8828,SC,1," 2/27/13"
Pink,"You Make Me Sick",CB30008,15,CB30008,CB,1," 2/27/13"
Placebo,"You Don't Care About Us",SF129,5,SF129,SF,1," 2/27/13"
"Platters, The","You'll Never Never Know",DK079,13,DK079,DK,1," 2/27/13"
Pod,"Youth Of The Nation",SC8803,14,SC8803,SC,1," 2/27/13"
"Pointer Sisters, The","Yes We Can-Can",SAVP29,16,SAVP29,SA,1," 2/27/13"
Poison,"Your Mama Don't Dance",SC8734,15,SC8734,SC,1," 2/27/13"
"Powell, Jesse",You,SC8523,11,SC8523,SC,1," 2/27/13"
"Presley, Elvis","Y Like Me, A Girl Like You, A",MMVEU-06,8,MMVEU-06,MM,1," 2/27/13"
"Presley, Elvis",Yesterday,MMVE16,8,MMVE16,MM,1," 2/27/13"
"Presley, Elvis","You Can't Say No In Acapulco",MMVEU-01,12,MMVEU-01,MM,1," 2/27/13"
"Presley, Elvis","You Don't Have To Say You Love Me",SAVP13,14,SAVP13,SA,1," 2/27/13"
"Presley, Elvis","You Don't Know Me",MM6288,6,MM6288,MM,1," 2/27/13"
"Presley, Elvis","You Don't Know Me  Clambake",MMVE20,6,MMVE20,MM,1," 2/27/13"
"Presley, Elvis","You Gave Me A Mountain",MMVE03,15,MMVE03,MM,1," 2/27/13"
"Presley, Elvis","You Gotta Stop (Easy Come Easy Go)",MMVEU-04,14,MMVEU-04,MM,1," 2/27/13"
"Presley, Elvis","You Were Always On My Mind",MMVE01,9,MMVE01,MM,1," 2/27/13"
"Presley, Elvis","You'll Be Gone",MM6414,15,MM6414,MM,1," 2/27/13"
"Presley, Elvis","You'll Never Walk Alone",SC8536,1,SC8536,SC,1," 2/27/13"
"Presley, Elvis","You'll Think Of Me",MMVEU-06,7,MMVEU-06,MM,1," 2/27/13"
"Presley, Elvis","You're So Square Baby I Don't Care",SC7521,8,SC7521,SC,1," 2/27/13"
"Presley, Elvis","You're The Boss",MMVEU-01,9,MMVEU-01,MM,1," 2/27/13"
"Presley, Elvis","You've Lost That Lovin' Feeling",MMVE16,11,MMVE16,MM,1," 2/27/13"
"Presley, Elvis","You've Lost That Loving Feeling",MM6248,11,MM6248,MM,1," 2/27/13"
"Presley, Elvis","Young And Beautiful",MM6123,2,MM6123,MM,1," 2/27/13"
"Presley, Elvis","Young And Beautiful  Jailhouse Rock",MMVE05,2,MMVE05,MM,1," 2/27/13"
"Presley, Elvis","Young Dreams",MM6415,15,MM6415,MM,1," 2/27/13"
"Presley, Elvis","Your Love's Been A Long Time Coming",MMVEU-05,5,MMVEU-05,MM,1," 2/27/13"
"Presley, Elvis","Your Time Hasn't Come Yet (Speedway)",MMVEU-04,13,MMVEU-04,MM,1," 2/27/13"
"Presley, Elvis & Ann Margaret","You're The Boss",MM6305,9,MM6305,MM,1," 2/27/13"
"Price, Kelley","You Should've Told Me",CB30013,6,CB30013,CB,1," 2/27/13"
"Price, Kelly","You Should've Told Me",SC8664,8,SC8664,SC,1," 2/27/13"
"Price, Ray","You're The Best Thing That Ever Happened",CBE2-05,10,CBE2-05,CB,1," 2/27/13"
"Price, Ray","You're The Best Thing That's Ever Happen",CB90076,2,CB90076,CB,1," 2/27/13"
"Pride, Charley","You're So Good When You're Bad",CBE4-17,9,CBE4-17,CB,1," 2/27/13"
"Pride, Charlie","You're So Good When You're Bad",CB90065,15,CB90065,CB,1," 2/27/13"
"Puckett, Gary & The Union Gap","Young Girl",DKM2030,9,DKM2030,DK,1," 2/27/13"
"Puckett, Gary & Union Gap","Young Girl",CBE3-18,3,CBE3-18,CB,1," 2/27/13"
"Puckett, Gary & Union Gap, The","Young Girl",SC7531,12,SC7531,SC,1," 2/27/13"
Queen,"You're My Best Friend",SC8772,7,SC8772,SC,1," 2/27/13"
"Rabbit, Eddie & Crystal Gayle","You And I",CB60041,1,CB60041,CB,1," 2/27/13"
"Rabbitt, Eddie","You Can't Run From Love",CB60167,14,CB60167,CB,1," 2/27/13"
"Rabbitt, Eddie","You Don't Love Me Anymore",SC8697,15,SC8697,SC,1," 2/27/13"
"Rabbitt, Eddie & Crystal Gayle","You & I",CBEP463-3,14,CBEP463-3,CB,1," 2/27/13"
"Rabbitt, Eddie & Crystal Gayle","You And I",MMCP2K07,11,MMCP2K07,MM,1," 2/27/13"
"Rabbitt, Eddie & Gayle, Crystal","You And I",SC7515,12,SC7515,SC,1," 2/27/13"
"Raitt, Bonnie",You,MM6069,4,MM6069,MM,1," 2/27/13"
"Raitt, Bonnie","You Got It",MM6091,2,MM6091,MM,1," 2/27/13"
"Rawls, Lou","You'll Never Find",SAVP32,18,SAVP32,SA,1," 2/27/13"
"Rawls, Lou","You'll Never Find (Another Love Like Min",SC7574,15,SC7574,SC,1," 2/27/13"
"Rawls, Lou","You'll Never Find Another Love Like Mine",SC8273,8,SC8273,SC,1," 2/27/13"
"Ray, Johnnie","Yes Tonight Josephine",SF062,15,SF062,SF,1," 2/27/13"
"Raye, Collin","You Still Take Me There",SD082,9,SD082,SD,1," 2/27/13"
"Real Thing, The","You To Me Are Everything",BL06,6,BL06,BL,1," 2/27/13"
"Ream, D.","You're The Best Thing",SF026,10,SF026,SF,1," 2/27/13"
"Red Peters","you ain't gettin shit for christmas",SC8900,15,SC8900,SC,1," 2/27/13"
"Reddy, Helen","You And Me Against The World",SC8410,15,SC8410,SC,1," 2/27/13"
"Reed, Jimmy","You Got Me Running",MM6144,13,MM6144,MM,1," 2/27/13"
"Restless Heart","You Can Depend On Me",CB90028,15,CB90028,CB,1," 2/27/13"
"Richie, Lionel","You Are",CB90169,15,CB90169,CB,1," 2/27/13"
"Righteous Brothers, The","You've Lost That Lovin' Feelin'",MMCP2K06,7,MMCP2K06,MM,1," 2/27/13"
"Righteous Brothers, The","You've Lost That Lovin' Feeling",MMBK06,7,MMBK06,MM,1," 2/27/13"
"Righteous Brothers, The","You've Lost That Loving Feeling",MM6037,13,MM6037,MM,1," 2/27/13"
"Rimes, Leann","You Light Up My Life",MMCOU202,17,MMCOU202,MM,1," 2/27/13"
"Rimes, Leann","Your Cheatin' Heart",SC8590,10,SC8590,SC,1," 2/27/13"
"Ritter, Tex","You Two-Timed Me One Time Too Often",SC8491,8,SC8491,SC,1," 2/27/13"
"Ritter, Tex","You Will Have To Pay",CB90222,5,CB90222,CB,1," 2/27/13"
"Robin Thicke","You're My Baby",PHMU0904,3,PHMU0904,PH,1," 2/27/13"
"Robinson, Smokey","You've Really Got A Hold On Me",DK012,16,DK012,DK,1," 2/27/13"
"Robison, Charlie","You're Not The Best",CB60179,14,CB60179,CB,1," 2/27/13"
"Rod Stewart","You Wear It Well",SC8197,10,SC8197,SC,1," 2/27/13"
"Rodriguez, Johnny","You Always Come Back To Hurting Me",SC8494,15,SC8494,SC,1," 2/27/13"
"Rodriguez, Johnny","You Can Say That Again",SC8311,7,SC8311,SC,1," 2/27/13"
"Rogers, Kenny","You Decorated My Life",CB90051,11,CB90051,CB,1," 2/27/13"
"Rolling Stones","You Got Me Rocking",SC8820,9,SC8820,SC,1," 2/27/13"
"Rolling Stones, The","You Can't Always Get What You Want",SC8300,8,SC8300,SC,1," 2/27/13"
"Ronnie Dunn","Your Kind Of Love",PHMC1112,6,PHMC1112,PH,1," 2/27/13"
"Ronstadt, Linda","You're No Good",SC7581,6,SC7581,SC,1," 2/27/13"
"Roth, David Lee","Yankee Rose",SC7565,12,SC7565,SC,1," 2/27/13"
"Run Dmc","You Be Illin'",SC8612,10,SC8612,SC,1," 2/27/13"
"Ryan Leslie","You're Not My Girl",PHMU0911,8,PHMU0911,PH,1," 2/27/13"
Sade,"Your Love Is King",SC7549,10,SC7549,SC,1," 2/27/13"
Saliva,"Your Disease",SC8699,10,SC8699,SC,1," 2/27/13"
"Sam Cooke","You Send Me",SCMILE01,2,SCMILE01,SC,1," 2/27/13"
"Sayer, Leo","You Make Me Feel Like Dancing",SC8439,15,SC8439,SC,1," 2/27/13"
"Sea Horses","You Can Talk To Me",SF117,10,SF117,SF,1," 2/27/13"
"Seals, Dan","You Still Move Me",SC8551,11,SC8551,SC,1," 2/27/13"
"Seger, Bob","You'll Accomp'ny Me",SC2159,8,SC2159,SC,1," 2/27/13"
"Seger, Bob & The Silver Bullet Band","You'll Accomp'ny Me",SC8846,9,SC8846,SC,1," 2/27/13"
Shanice,Yesterday,SC8542,3,SC8542,SC,1," 2/27/13"
"Shapiro, Helen","You Don't Know",SAVP08,12,SAVP08,SA,1," 2/27/13"
"Sheppard, T. G.","You Still Do",CB90109,6,CB90109,CB,1," 2/27/13"
"Sheppard, T.g.","You Still Do",CB60128,7,CB60128,CB,1," 2/27/13"
"Shields, The","You Cheated, You Lied",MM6385,13,MM6385,MM,1," 2/27/13"
"Shola Ama","You're The One I Love",SF114,9,SF114,SF,1," 2/27/13"
"Simon, Carly","You Belong To Me",SC7549,6,SC7549,SC,1," 2/27/13"
"Simon, Carly","You're So Vain",MM6333,11,MM6333,MM,1," 2/27/13"
"Simon, Paul","You Can Call Me Al",CBE4-06,15,CBE4-06,CB,1," 2/27/13"
"Simple Plan","Your Love Is A Lie",PHMP0805,7,PHMP0805,PH,1," 2/27/13"
"Simply Red","You Make Me Feel Brand New",SF213,14,SF213,SF,1," 2/27/13"
"Sinatra, Frank","You Brought A New Kind Of Love",MM6075,10,MM6075,MM,1," 2/27/13"
"Sinatra, Frank","You Do Something To Me",SAVP35,16,SAVP35,SA,1," 2/27/13"
"Sinatra, Frank","You Go To My Head",MM6242,8,MM6242,MM,1," 2/27/13"
"Sinatra, Frank","You Make Me Feel So Young",MMSTA05,20,MMSTA05,MM,1," 2/27/13"
"Sinatra, Frank","Young At Heart",MM6075,4,MM6075,MM,1," 2/27/13"
"Sinatra, Nancy","You Only Live Twice",SC8468,6,SC8468,SC,1," 2/27/13"
"Skaggs, Ricky","You May See Me Walkin'",SC8582,1,SC8582,SC,1," 2/27/13"
"Skid Row","Youth Gone Wild",SC8406,7,SC8406,SC,1," 2/27/13"
"Smash Mouth","You Are My Number One",PHM0309,5,PHM0309,PH,1," 2/27/13"
"Smash Mouth wvocal","You Are My Number One",PHM0309,14,PHM0309,PH,1," 2/27/13"
"Smith, Carl","You Are The One",SC8712,11,SC8712,SC,1," 2/27/13"
"Smith, Connie","You And Your Sweet Love",CB90088,11,CB90088,CB,1," 2/27/13"
"Smith, Rex","You Take My Breath Away",SC8552,9,SC8552,SC,1," 2/27/13"
"South Pacific","Younger Than Springtime",DK092,5,DK092,DK,1," 2/27/13"
"Souther, J.d.","You're Only Lonely",SC8594,5,SC8594,SC,1," 2/27/13"
"Southern Man","Young, Neil",DG06,13,DG06,DG,1," 2/27/13"
Spanish,"Y Viva Espana",SF028,18,SF028,SF,1," 2/27/13"
"Spears, Britney","You Drive Me Crazy",CBE2-29,15,CBE2-29,CB,1," 2/27/13"
"Spears, Britney wvocal","You Drive Me Crazy",PHM9911,13,PHM9911,PH,1," 2/27/13"
"Spin Doctors, The","You Let Your Heart Go Too Fast",SD001,11,SD001,SD,1," 2/27/13"
"Springfield, Dusty","You Don't Have To Say You Love Me",SGB41,15,SGB41,SG,1," 2/27/13"
"Stafford, Jo","You Belong To Me",SAVP07,10,SAVP07,SA,1," 2/27/13"
Standard,"Yankee Doodle",SC2023,5,SC2023,SC,1," 2/27/13"
Standard,"Yellow Rose Of Texas, The",CBEP469-3,14,CBEP469-3,CB,1," 2/27/13"
Standard,"You're A Grand Old Flag",CBE4-30,6,CBE4-30,CB,1," 2/27/13"
"Standard Reminiscing","Yellow Rose Of Texas, The",SC7024,7,SC7024,SC,1," 2/27/13"
"Standard Reminiscing","Yes Sir That's My Baby",SC7029,5,SC7029,SC,1," 2/27/13"
"Standard Reminiscing","Yes We Have No Bananas",SC7029,6,SC7029,SC,1," 2/27/13"
"Standard Reminiscing","You Are My Sunshine",SC7022,7,SC7022,SC,1," 2/27/13"
"Standard Reminiscing","You Made Me Love You",SC7029,1,SC7029,SC,1," 2/27/13"
Standard-Traditional,"Yellow Rose Of Texas, The",DK061,15,DK061,DK,1," 2/27/13"
Standard-Traditional,"You Are My Sunshine",DKM2028,8,DKM2028,DK,1," 2/27/13"
Standard-Traditional,"You'd Be So Nice To Come Home To",DK067,14,DK067,DK,1," 2/27/13"
Standardl,"You Belong To Me",DK045,10,DK045,DK,1," 2/27/13"
"Starr, Ringo","You're Sixteen",SAVP37,19,SAVP37,SA,1," 2/27/13"
"Statler Brothers, The","You Can't Have Your Kate & Edith, Too",CB90135,11,CB90135,CB,1," 2/27/13"
"Statler Brothers, The","You'll Be Back (Every Night In My Dreams",SC8604,8,SC8604,SC,1," 2/27/13"
"Staton, Candi","Young Hearts Run Free",SF003,15,SF003,SF,1," 2/27/13"
"Steve Azar","You're My Life",PHMC0904,7,PHMC0904,PH,1," 2/27/13"
"Stevens, Shakin'","You Drive Me Crazy",SF031,5,SF031,SF,1," 2/27/13"
"Stewart, Al","Year Of The Cat, The",SD020,11,SD020,SD,1," 2/27/13"
"Stewart, Gary","Your Place Or Mine",SC8642,10,SC8642,SC,1," 2/27/13"
"Stewart, Rod","You Go To My Head",MM6388,1,MM6388,MM,1," 2/27/13"
"Stewart, Rod","You Wear It Well",MM6388,13,MM6388,MM,1," 2/27/13"
"Stewart, Rod","You're In My Heart",SC8722,13,SC8722,SC,1," 2/27/13"
"Stewart, Rod","Young Turks",MM6171,15,MM6171,MM,1," 2/27/13"
"Stewart, Rod","Your Song",SC8238,3,SC8238,SC,1," 2/27/13"
Sting,"You Still Touch Me",SC8290,13,SC8290,SC,1," 2/27/13"
"Stone, Doug","You Have The Right To Remain Silent",MM6101,8,MM6101,MM,1," 2/27/13"
"Stone, Joss","You Had Me",PHM0501,8,PHM0501,PH,1," 2/27/13"
"Strait, George","You Can't Make A Heart Love Somebody",SC8703,15,SC8703,SC,1," 2/27/13"
"Strait, George","You Haven't Left Me Yet",CB90018,15,CB90018,CB,1," 2/27/13"
"Strait, George","You Know Me Better Than That",CB90149,9,CB90149,CB,1," 2/27/13"
"Strait, George","You Look So Good In Love",CBE2-08,15,CBE2-08,CB,1," 2/27/13"
"Strait, George","You're Something Special To Me",SC8345,2,SC8345,SC,1," 2/27/13"
"Strange Condition","Yorn, Pete",PHR0205,1,PHR0205,PH,1," 2/27/13"
"Streisand & Diamond","You Don't Bring Me Flowers",MMSTA2-3,18,MMSTA2-3,MM,1," 2/27/13"
"Streisand, Barbra","You Don't Bring Me Flowers",MMBK07,1,MMBK07,MM,1," 2/27/13"
"Streisand, Barbra & Neil Diamond","You Don't Bring Me Flowers",CBEP471-2,6,CBEP471-2,CB,1," 2/27/13"
"Stuart, Marty","You Can't Stop Love",CB20241,9,CB20241,CB,1," 2/27/13"
"Stylistics, The","You Are Everything",SAVP31,9,SAVP31,SA,1," 2/27/13"
"Stylistics, The","You Make Me Feel Brand New",MM6198,15,MM6198,MM,1," 2/27/13"
"Supernaw, Doug","You Still Got Me",MM6158,9,MM6158,MM,1," 2/27/13"
"Supremes, The","You Can't Hurry Love",SC7571,13,SC7571,SC,1," 2/27/13"
"Supremes, The","You Keep Me Hanging On",SC7532,15,SC7532,SC,1," 2/27/13"
Swv,"You're The One",SC8281,6,SC8281,SC,1," 2/27/13"
Sylvester,"You Make Me Feel (Mighty Real)",BL25,12,BL25,BL,1," 2/27/13"
"Take 6","You Can Never Ask Too Much",SC8156,2,SC8156,SC,1," 2/27/13"
"Taylor, James","You've Got A Friend",BL18,13,BL18,BL,1," 2/27/13"
"Taylor, James","Your Smiling Face",SC7575,13,SC7575,SC,1," 2/27/13"
"Temperance Seven","You're Driving Me Crazy",SF069,15,SF069,SF,1," 2/27/13"
"The Band Perry","You Lie",PHMC1103,3,PHMC1103,PH,1," 2/27/13"
"The Fray","You Found Me",PHMP0902,1,PHMP0902,PH,1," 2/27/13"
"The White Tie Affair","You Look Better When Im Drunk",PHMP1008,3,PHMP1008,PH,1," 2/27/13"
"Third Day","You Are So Good To Me",CBE4-29,3,CBE4-29,CB,1," 2/27/13"
"Thompson Twins, The","You Take Me Up",SF111,13,SF111,SF,1," 2/27/13"
"Tillis, Mel","Your Body Is An Outlaw",CB90089,12,CB90089,CB,1," 2/27/13"
"Tippin, Aaron","You've Got To Stand For Something",SC7552,15,SC7552,SC,1," 2/27/13"
"Tippin, Aaron wvocal","You've Got To Stand For Something",SC2336A,9,SC2336A,SC,1," 2/27/13"
"Toback, Jeremy","You Make Me Feel",SC8595,2,SC8595,SC,1," 2/27/13"
Tonic,"You Wanted More",SC8553,15,SC8553,SC,1," 2/27/13"
"Tower Of Power","You're Still A Young Man",SC8204,2,SC8204,SC,1," 2/27/13"
"Trace Adkins","You're Gonna Miss This",PHMC0803,6,PHMC0803,PH,1," 2/27/13"
Traditional,"You Are My Sunshine",DK096,11,DK096,DK,1," 2/27/13"
Traditional,"You Go To My Head",SGB059,9,SGB059,SG,1," 2/27/13"
"Travolta, John & Newton-John, Olivia","You're The One That I Want",SC7506,14,SC7506,SC,1," 2/27/13"
"Travolta, John & Olivia Newton John","You're The One That I Want",MMCP2K07,18,MMCP2K07,MM,1," 2/27/13"
"Tritt, Travis","You Can't Count Me Out Yet",SD103,5,SD103,SD,1," 2/27/13"
